{
  "schema_version": 1,
  "meal_id": "meal-synthetic-001",
  "eaten_at": "2026-02-03T08:15:00+09:00",
  "meal_type": "breakfast",
  "original_text": "Synthetic breakfast: two recovery bars and one mystery side",
  "parser_version": "synthetic-parser-v1",
  "model_version": "synthetic-model-v1",
  "notes": "Generated test data only",
  "items": [
    {
      "meal_id": "meal-synthetic-001",
      "sequence": 1,
      "food_name": "Synthetic Recovery Bar",
      "food_profile_id": "profile-synthetic-recovery-bar",
      "quantity": "2",
      "quantity_unit": "pack",
      "serving_description": "2 packs",
      "nutrition_facts": [
        {
          "fact_id": "fact-label-001",
          "values": {
            "calories_kcal": "123.4",
            "protein_g": "20.5",
            "carbohydrate_g": "8.25",
            "fat_g": "1.75"
          },
          "basis_quantity": "1",
          "basis_unit": "pack",
          "provenance": {
            "source_type": "nutrition_label",
            "source_reference": "synthetic-label://recovery-bar-v1",
            "confidence": "1",
            "accuracy": "exact",
            "parser_version": null,
            "model_version": null,
            "created_at": "2026-02-03T08:16:00+09:00"
          },
          "value_range": null,
          "supersedes_fact_id": null
        }
      ]
    },
    {
      "meal_id": "meal-synthetic-001",
      "sequence": 2,
      "food_name": "Synthetic Mystery Side",
      "food_profile_id": null,
      "quantity": null,
      "quantity_unit": null,
      "serving_description": "one unspecified portion",
      "nutrition_facts": []
    }
  ]
}
